1,画面に表示される画像の中から、一つほかの画像と違うものを選んでください。,正解の場合は、画像が切り替わります。\n不正解の場合は、制限時間が短くなります。,繰り返し正解を選んでいって、制限時間が終わる前にたくさん問題を解きましょう。
2,画面に表示される単語を入力してください。\n「タップして入力」と書いてある場所をタップするとキーボードが表示されます。,正解の場合は、次の文字列が表示されます。\n不正解の場合は、制限時間が短くなります。,繰り返し正解を選んでいって、制限時間が終わる前にたくさん問題を解きましょう。
3,画面を縦にスクロールして、宝箱を見つけましょう。\n宝箱を画面中央の赤い場所に入れてください。,宝箱が画面中央に入って三秒経つと、正解となります。\n正解すると、宝箱の位置が変わります。,急いで宝箱を探して、制限時間が終わる前にたくさん問題を解きましょう。
4,画面を横にスワイプして、猫を見つけましょう。\n見つけたら、画面に映っている状態で、「解答」を押してください。,正しい画面の状態で「解答」を押すと正解になります。\n正解すると、コインがたまり、猫の位置が変わります。,急いで画像を探して、制限時間が終わる前にたくさん問題を解きましょう。
5,画面に表示される数字のピースをドラッグして、\n　１　２　３\n　４　５　６\n　７　８　９\nの順に並び替えてください。,正しい数字の配置で「解答」を押すと正解になります。\n配置が正しくないと不正解になります。\n不正解になると、制限時間が短くなります。,正確に数字を配置し、制限時間が終わる前にたくさん問題を解きましょう。
6,画面に表示される問題を見て、問題に答えましょう。\n問題下にある白い四角の所に文字のピースをドラッグして解答を完成させましょう。,正しい回答の配置で「解答」を押すと正解になります。\n配置が正しくないと不正解になります。\n不正解になると、制限時間が短くなります。,正確に文字を配置し、制限時間が終わる前にたくさん問題を解きましょう。